{
  "unapplied_cash_application_presentment_contract_version": 1,
  "unapplied_cash_application_id": "019d7b92-1aa0-7a7f-b61c-962c0f4bfd81",
  "tenant_reference": "urn:cwl:tenant_001",
  "unapplied_cash_id": "019d7b92-1aa0-7a7f-b61c-962c0f4bfd85",
  "collection_case_id": "019d7b92-1aa0-7a7f-b61c-962c0f4bfd83",
  "payment_receipt_id": "019d7b92-1aa0-7a7f-b61c-962c0f4bfd86",
  "invoice_draft_id": "019d7b92-1aa0-7a7f-b61c-962c0f4bfd84",
  "currency_code": "USD",
  "applied_amount": "0.001",
  "remaining_outstanding_amount": "19.999",
  "unapplied_cash_application_status": "applied",
  "collection_case_status": "open",
  "applied_at": "2026-08-18T15:00:00Z",
  "source_payload_hash": "sha256:ffffffffffffffffffffffffffffffffffffffffffffffffffffffffffffffff",
  "next_operator_action": "collect"
}
